{
  "apiVersion": "project-template.dsh/v1alpha1",
  "kind": "ProjectTemplate",
  "metadata": {
    "templateId": "minimal-standard",
    "templateVersion": "1.0.0",
    "displayName": "最小标准项目",
    "description": "项目说明、PRD、进展入口、下一步与受管理元数据。",
    "protocolVersion": "project-control.dsh/v1alpha1"
  },
  "files": [
    {
      "kind": "directory",
      "relativePath": ".dsh-project"
    },
    {
      "kind": "file",
      "relativePath": ".dsh-project/project.yaml",
      "content": "apiVersion: project-control.dsh/v1alpha1\nkind: ProjectManifest\nmetadata:\n  projectId: {{PROJECT_ID}}\n  name: {{PROJECT_NAME}}\n  createdAt: {{CREATED_AT}}\n  createdBy:\n    kind: human\n    id: cyrus\n  origin:\n    kind: template\n    templateId: {{TEMPLATE_ID}}\n    templateVersion: {{TEMPLATE_VERSION}}\nspec:\n  documents:\n    docsRoot: docs\n    entries:\n      - role: readme\n        path: README.md\n      - role: prd\n        path: docs/PRD.md\n        required: true\n      - role: devlog\n        path: docs/DEVLOG.md\n      - role: next\n        path: docs/NEXT.md\n    standardOutputs:\n      updatesRoot: .dsh-project/updates\n      decisionsRoot: .dsh-project/decisions\n      artifactsRoot: .dsh-project/artifacts\n"
    },
    {
      "kind": "directory",
      "relativePath": "docs"
    },
    {
      "kind": "file",
      "relativePath": "docs/PRD.md",
      "content": "# {{PROJECT_NAME}} 产品需求\n\n> 待填写：目标、成功标准与范围。本文由 {{TEMPLATE_ID}}@{{TEMPLATE_VERSION}} 创建于 {{CREATED_AT}}，请在此补齐后作为 PRD 事实源。\n"
    },
    {
      "kind": "file",
      "relativePath": "docs/DEVLOG.md",
      "content": "# 开发日志\n\n> 待填写：按日期记录决策、验证结果与已知边界。\n"
    },
    {
      "kind": "file",
      "relativePath": "docs/NEXT.md",
      "content": "# 下一步\n\n> 待填写：下一阶段执行清单与验收顺序。\n"
    },
    {
      "kind": "file",
      "relativePath": "README.md",
      "content": "# {{PROJECT_NAME}}\n\n> 待填写：项目说明与运行方式。\n"
    }
  ]
}
